{
  "schemaVersion": 1,
  "a": "17.0.0",
  "b": "eef3a27815e743c059e0fd74ed5a1efb149c7ff5",
  "refs": {
    "a": "v17.0.0",
    "b": "eef3a27815e743c059e0fd74ed5a1efb149c7ff5"
  },
  "version": "eef3a27815e743c059e0fd74ed5a1efb149c7ff5",
  "repo": "tutors-sdk/tutors-mono-repo",
  "history": {
    "asked": 6,
    "releases": [
      {
        "from": "v16.2.2",
        "to": "v17.0.0"
      },
      {
        "from": "v16.2.1",
        "to": "v16.2.2"
      },
      {
        "from": "v16.2.0",
        "to": "v16.2.1"
      },
      {
        "from": "v16.1.8",
        "to": "v16.2.0"
      },
      {
        "from": "v16.1.6",
        "to": "v16.1.8"
      },
      {
        "from": "v16.1.5",
        "to": "v16.1.6"
      }
    ]
  },
  "score": 0,
  "lost": 339,
  "floorBreached": false,
  "prs": [
    {
      "pr": 476,
      "sha": "90152846e9fea43cfe37ec0489a038ce9f2bfa8f",
      "title": "Give each whiteboard room a Realtime budget",
      "url": "https://github.com/tutors-sdk/tutors-mono-repo/pull/476",
      "direct": false,
      "release": false,
      "author": "Claude",
      "firstContribution": false,
      "files": [
        "apps/reader/static/excalidraw-editor.html",
        "guides/WHITEBOARD.md",
        "tests/bdd/features/shared/realtime-usage.feature",
        "tests/bdd/steps/shared/realtime-usage.steps.ts",
        "tests/bdd/support/whiteboard-editor.ts"
      ],
      "churn": 377,
      "hotspotsTouched": [],
      "testDelta": {
        "production": 0,
        "tests": 285,
        "ratio": null,
        "packages": []
      },
      "reviewed": true,
      "points": 10,
      "deductions": [
        {
          "points": 10,
          "rule": "orphan",
          "why": "PR #476 changed Reader, Development but no changelog entry under veef3a27815e743c059e0fd74ed5a1efb149c7ff5 names it",
          "evidence": "https://github.com/tutors-sdk/tutors-mono-repo/pull/476/files#diff-f9cfd30e49727585d340eb245e9e85897abbbba627faf3c588167b9ed13bf276",
          "file": "apps/reader/static/excalidraw-editor.html",
          "pr": 476,
          "author": "Claude"
        }
      ]
    },
    {
      "pr": 478,
      "sha": "7c4028ade19fde26ea11b236e2b16dff572f1a5e",
      "title": "Route every Realtime channel through a budgeted port",
      "url": "https://github.com/tutors-sdk/tutors-mono-repo/pull/478",
      "direct": false,
      "release": false,
      "author": "Claude",
      "firstContribution": false,
      "files": [
        ".dependency-cruiser.cjs",
        "ARCHITECTURE.md",
        "CHANGELOG.md",
        "CONTRIBUTING.md",
        "README.md",
        "apps/reader/static/excalidraw-editor.html",
        "deno.json",
        "etc/realtime.api.md",
        "packages/jsr/realtime/deno.json",
        "packages/jsr/realtime/package.json",
        "packages/jsr/realtime/src/index.ts",
        "packages/svelte/community/package.json",
        "packages/svelte/community/src/services/live.svelte.ts",
        "packages/svelte/community/src/services/presence.svelte.ts",
        "packages/svelte/community/src/services/realtime.ts",
        "packages/svelte/community/src/types.svelte.ts",
        "packages/svelte/community/src/utils/supabase-client.ts",
        "packages/svelte/connect/src/services/connect.svelte.ts",
        "packages/svelte/realtime-supabase/package.json",
        "packages/svelte/realtime-supabase/src/index.ts",
        "pnpm-lock.yaml",
        "release/README.md",
        "release/claims.yaml",
        "scripts/api-surface.ts",
        "scripts/checks/release-claims.ts",
        "scripts/release-claims-draft.ts",
        "tests/architecture/dependency-rules.test.ts",
        "tests/architecture/fixtures/workspace/packages/jsr/realtime/src/broker.ts",
        "tests/architecture/realtime-boundary.test.ts",
        "tests/bdd/features/shared/realtime-gateway.feature",
        "tests/bdd/features/shared/realtime-usage.feature",
        "tests/bdd/steps/shared/realtime-gateway.steps.ts",
        "tests/bdd/steps/shared/realtime-usage.steps.ts",
        "tests/bdd/support/connect.ts",
        "tests/bdd/support/supabase-recorder.ts",
        "tests/bdd/support/whiteboard-editor.ts",
        "tests/conformance/release-claims.test.ts",
        "tests/suite-health/coverage-floors.json",
        "tests/unit/community/health-check.test.ts",
        "tests/unit/community/presence-broadcast.test.ts",
        "vitest.aliases.ts"
      ],
      "churn": 1349,
      "hotspotsTouched": [
        "packages/svelte/connect/src/services/connect.svelte.ts"
      ],
      "testDelta": {
        "production": 446,
        "tests": 650,
        "ratio": 1.46,
        "packages": [
          {
            "package": "packages/jsr/realtime",
            "production": 280,
            "tests": 650,
            "ratio": 2.32
          },
          {
            "package": "packages/svelte/community",
            "production": 131,
            "tests": 650,
            "ratio": 4.96
          },
          {
            "package": "packages/svelte/connect",
            "production": 1,
            "tests": 650,
            "ratio": 650
          },
          {
            "package": "packages/svelte/realtime-supabase",
            "production": 34,
            "tests": 650,
            "ratio": 19.12
          }
        ]
      },
      "reviewed": true,
      "points": 13,
      "deductions": [
        {
          "points": 3,
          "rule": "hotspot",
          "why": "PR #478 touches hotspot packages/svelte/connect/src/services/connect.svelte.ts (3 of the last 6 releases)",
          "evidence": "https://github.com/tutors-sdk/tutors-mono-repo/pull/478/files#diff-fd4035ac7c862123cdae65175cc120073c7245aa50e8aab37b76da2aaefd542b",
          "file": "packages/svelte/connect/src/services/connect.svelte.ts",
          "pr": 478,
          "author": "Claude"
        },
        {
          "points": 10,
          "rule": "orphan",
          "why": "PR #478 changed Reader, Shared Packages, Infrastructure, Development but no changelog entry under veef3a27815e743c059e0fd74ed5a1efb149c7ff5 names it",
          "evidence": "https://github.com/tutors-sdk/tutors-mono-repo/pull/478/files#diff-f9cfd30e49727585d340eb245e9e85897abbbba627faf3c588167b9ed13bf276",
          "file": "apps/reader/static/excalidraw-editor.html",
          "pr": 478,
          "author": "Claude"
        }
      ]
    },
    {
      "pr": 480,
      "sha": "9bf447dee21d5d88653e92ba52ae7a603412ab42",
      "title": "Tutors Time: read only the chosen days of a course's calendar",
      "url": "https://github.com/tutors-sdk/tutors-mono-repo/pull/480",
      "direct": false,
      "release": false,
      "author": "Claude",
      "firstContribution": false,
      "files": [
        "packages/jsr/time/src/services/course-time.ts",
        "supabase/migrations/20261015_calendar_course_day_index.sql",
        "tests/bdd/features/student/learning-progress.feature",
        "tests/bdd/steps/student/learning-progress.steps.ts",
        "tests/bdd/support/supabase-recorder.ts",
        "tests/suite-health/coverage-floors.json"
      ],
      "churn": 92,
      "hotspotsTouched": [],
      "testDelta": {
        "production": 20,
        "tests": 66,
        "ratio": 3.3,
        "packages": [
          {
            "package": "packages/jsr/time",
            "production": 20,
            "tests": 66,
            "ratio": 3.3
          }
        ]
      },
      "reviewed": true,
      "points": 10,
      "deductions": [
        {
          "points": 10,
          "rule": "orphan",
          "why": "PR #480 changed Shared Packages, Infrastructure, Development but no changelog entry under veef3a27815e743c059e0fd74ed5a1efb149c7ff5 names it",
          "evidence": "https://github.com/tutors-sdk/tutors-mono-repo/pull/480/files#diff-058494e42758c8229a1aa355997e6c7f3996785e11ea8dffba79c3870e22bce2",
          "file": "packages/jsr/time/src/services/course-time.ts",
          "pr": 480,
          "author": "Claude"
        }
      ]
    },
    {
      "pr": 481,
      "sha": "3613ee3644e9aa2a10c9fa8f0b404d0cd3e372f0",
      "title": "Tutors Live: publish from the reader's server within a daily Realtime budget",
      "url": "https://github.com/tutors-sdk/tutors-mono-repo/pull/481",
      "direct": false,
      "release": false,
      "author": "Claude",
      "firstContribution": false,
      "files": [
        "ARCHITECTURE.md",
        "apps/reader/src/routes/api/live/activity/+server.ts",
        "packages/svelte/community/src/services/live-activity.ts",
        "packages/svelte/community/src/services/live-feed.ts",
        "packages/svelte/community/src/services/live.svelte.ts",
        "packages/svelte/community/src/services/presence.svelte.ts",
        "packages/svelte/community/src/utils/supabase-client.ts",
        "supabase/migrations/20261016_realtime_live_budget.sql",
        "tests/bdd/features/shared/live-activity-budget.feature",
        "tests/bdd/features/shared/realtime-usage.feature",
        "tests/bdd/features/student/live-presence.feature",
        "tests/bdd/steps/shared/authentication.steps.ts",
        "tests/bdd/steps/shared/live-activity-budget.steps.ts",
        "tests/bdd/steps/shared/realtime-usage.steps.ts",
        "tests/bdd/steps/student/learning-progress.steps.ts",
        "tests/bdd/steps/student/live-presence.steps.ts",
        "tests/bdd/support/connect.ts",
        "tests/bdd/support/supabase-recorder.ts",
        "tests/security/mutating-routes.txt",
        "tests/suite-health/coverage-floors.json",
        "tests/unit/community/error-transport.test.ts",
        "tests/unit/community/presence-broadcast.test.ts",
        "tests/unit/community/presence-live-report.test.ts"
      ],
      "churn": 1421,
      "hotspotsTouched": [],
      "testDelta": {
        "production": 281,
        "tests": 950,
        "ratio": 3.38,
        "packages": [
          {
            "package": "apps/reader",